{
  "reference": "Liu, L., Zhang, B.-M., Wang, D.-F., & Wu, Z.-J. (2006). Effects of cure cycles on void content and mechanical properties of composite laminates. Composite Structures, 73, 303-309.",
  "doi": "10.1016/j.compstruct.2005.02.001",
  "data_source": "Table 1, Figs. 12-13",
  "material": {
    "fiber": "T700",
    "matrix": "TDE85 epoxy",
    "fiber_volume_fraction": 0.60,
    "n_plies": 12,
    "ply_angles": [0, 90, 0, 90, 0, 90, 90, 0, 90, 0, 90, 0],
    "layup_name": "[0/90]3s"
  },
  "porosity_measurement": "acid digestion (ASTM 3171)",
  "baseline_porosity_pct": 0.6,
  "properties": {
    "ilss": {
      "test_standard": "ASTM D2344",
      "test_config": {"temperature_C": 23, "n_specimens_per_point": 5},
      "void_content_pct": [0.6, 0.9, 1.0, 1.2, 1.5, 2.0, 2.2, 3.2],
      "normalized_values": [1.00, 0.98, 0.97, 0.96, 0.93, 0.89, 0.87, 0.82],
      "digitization_method": "tabulated"
    },
    "flexural_strength": {
      "test_standard": "ASTM D790",
      "test_config": {"span_to_depth": 32, "temperature_C": 23, "n_specimens_per_point": 5},
      "void_content_pct": [0.6, 0.9, 1.0, 1.2, 1.5, 2.0, 2.2, 3.2],
      "normalized_values": [1.00, 0.97, 0.97, 0.94, 0.92, 0.87, 0.85, 0.78],
      "digitization_method": "tabulated"
    },
    "flexural_modulus": {
      "test_standard": "ASTM D790",
      "test_config": {"span_to_depth": 32, "temperature_C": 23, "n_specimens_per_point": 5},
      "void_content_pct": [0.6, 0.9, 1.0, 1.2, 1.5, 2.0, 2.2, 3.2],
      "normalized_values": [1.00, 0.98, 0.97, 0.96, 0.94, 0.90, 0.88, 0.82],
      "digitization_method": "tabulated"
    },
    "tensile_strength": {
      "test_standard": "ASTM D3039",
      "test_config": {"temperature_C": 23, "n_specimens_per_point": 5},
      "void_content_pct": [0.6, 0.9, 1.0, 1.2, 1.5, 2.0, 2.2, 3.2],
      "normalized_values": [1.00, 0.98, 0.98, 0.96, 0.96, 0.93, 0.92, 0.86],
      "digitization_method": "tabulated"
    },
    "tensile_modulus": {
      "test_standard": "ASTM D3039",
      "test_config": {"temperature_C": 23, "n_specimens_per_point": 5},
      "void_content_pct": [0.6, 0.9, 1.0, 1.2, 1.5, 2.0, 2.2, 3.2],
      "normalized_values": [1.00, 0.99, 0.99, 0.99, 0.98, 0.97, 0.97, 0.96],
      "digitization_method": "tabulated"
    }
  },
  "notes": "All values normalized to 0.6% void baseline (specimen at 0.6 MPa cure pressure). 5 properties from Figs. 12-13."
}
