{
  "reference": "Tang, J.-M., Lee, W.I., & Springer, G.S. (1987). Effects of cure pressure on resin flow, voids, and mechanical properties. Journal of Composite Materials, 21(5), 421-440.",
  "doi": "10.1177/002199838702100502",
  "data_source": "Tables 2-4",
  "material": {
    "fiber": "T300",
    "matrix": "976 epoxy",
    "fiber_volume_fraction": 0.6,
    "n_plies": 16,
    "ply_angles": [
      0,
      0,
      0,
      0,
      0,
      0,
      0,
      0,
      0,
      0,
      0,
      0,
      0,
      0,
      0,
      0
    ],
    "layup_name": "(0)16"
  },
  "porosity_measurement": "acid digestion",
  "baseline_porosity_pct": 0.3,
  "properties": {
    "tensile_strength": {
      "test_standard": "ASTM D3039",
      "test_config": {
        "loading_direction_deg": 0,
        "temperature_C": 23,
        "n_specimens_per_point": 5
      },
      "void_content_pct": [
        0.3,
        1.0,
        2.0,
        3.5,
        5.0
      ],
      "normalized_values": [
        1.0,
        0.975,
        0.92,
        0.84,
        0.76
      ],
      "digitization_method": "tabulated"
    },
    "flexural_modulus": {
      "test_standard": "ASTM D790",
      "test_config": {
        "loading_direction_deg": 0,
        "span_to_depth": 32,
        "temperature_C": 23,
        "n_specimens_per_point": 5
      },
      "void_content_pct": [
        0.3,
        1.0,
        2.0,
        3.5,
        5.0
      ],
      "normalized_values": [
        1.0,
        0.98,
        0.94,
        0.89,
        0.84
      ],
      "digitization_method": "tabulated"
    },
    "ilss": {
      "test_standard": "ASTM D2344",
      "test_config": {
        "temperature_C": 23,
        "n_specimens_per_point": 5
      },
      "void_content_pct": [
        0.3,
        1.0,
        2.0,
        3.5,
        5.0
      ],
      "normalized_values": [
        1.0,
        0.92,
        0.82,
        0.69,
        0.57
      ],
      "digitization_method": "tabulated"
    }
  },
  "notes": "T300/976 system (one of two in paper; T300/934 is separate dataset if needed). Cure-pressure-controlled porosity. Foundational process-property link paper."
}
