{
  "reference": "Olivier, P., Cottu, J.P., & Ferret, B. (1995). Effects of cure cycle pressure and voids on some mechanical properties of carbon/epoxy laminates. Composites, 26(7), 509-515.",
  "doi": "10.1016/0010-4361(95)96808-J",
  "data_source": "Tables 1-3",
  "material": {
    "fiber": "T300",
    "matrix": "914 epoxy",
    "fiber_volume_fraction": 0.58,
    "n_plies": 16,
    "ply_angles": [0, 0, 0, 0, 0, 0, 0, 0, 0, 0, 0, 0, 0, 0, 0, 0],
    "layup_name": "(0)16"
  },
  "porosity_measurement": "image analysis + density",
  "baseline_porosity_pct": 0.3,
  "properties": {
    "tensile_strength": {
      "test_standard": "ASTM D3039",
      "test_config": {"loading_direction_deg": 0, "temperature_C": 23, "n_specimens_per_point": 6},
      "void_content_pct": [0.3, 1.5, 3.0, 5.0, 7.0, 10.0],
      "normalized_values": [1.000, 0.970, 0.915, 0.835, 0.760, 0.670],
      "digitization_method": "tabulated"
    },
    "flexural_strength": {
      "test_standard": "ASTM D790",
      "test_config": {"loading_direction_deg": 0, "span_to_depth": 16, "temperature_C": 23, "n_specimens_per_point": 6},
      "void_content_pct": [0.3, 1.5, 3.0, 5.0, 7.0, 10.0],
      "normalized_values": [1.000, 0.940, 0.855, 0.720, 0.605, 0.480],
      "digitization_method": "tabulated"
    },
    "flexural_modulus": {
      "test_standard": "ASTM D790",
      "test_config": {"loading_direction_deg": 0, "span_to_depth": 16, "temperature_C": 23, "n_specimens_per_point": 6},
      "void_content_pct": [0.3, 1.5, 3.0, 5.0, 7.0, 10.0],
      "normalized_values": [1.000, 0.985, 0.950, 0.900, 0.850, 0.780],
      "digitization_method": "tabulated"
    },
    "ilss": {
      "test_standard": "ASTM D2344",
      "test_config": {"temperature_C": 23, "n_specimens_per_point": 6},
      "void_content_pct": [0.3, 1.5, 3.0, 5.0, 7.0, 10.0],
      "normalized_values": [1.000, 0.920, 0.830, 0.705, 0.600, 0.460],
      "digitization_method": "tabulated"
    }
  },
  "notes": "Data extends to 10% void content, broadest range in validation database. Values digitized from paper tables."
}
