{
  "reference": "Elhajjar, R. (2025). Fat-tailed failure strength distributions and manufacturing defects in advanced composites. Scientific Reports, 15:25977.",
  "doi": "10.1038/s41598-025-06693-4",
  "data_source": "Fig. 5a (digitized)",
  "material": {
    "fiber": "T700GC-12K-31E",
    "matrix": "#2510 epoxy",
    "fiber_volume_fraction": 0.544,
    "n_plies": 10,
    "ply_angles": [0, 45, 90, -45, 0, 0, -45, 90, 45, 0],
    "layup_name": "[0/45/90/-45/0]_s"
  },
  "porosity_measurement": "acid digestion",
  "baseline_porosity_pct": 0.5,
  "properties": {
    "compression_strength": {
      "test_standard": "ASTM D6641 (UNC)",
      "test_config": {
        "loading_direction_deg": 0,
        "temperature_C": 23,
        "humidity": "ambient",
        "n_specimens_per_point": 30
      },
      "void_content_pct": [0.5, 0.7, 0.8, 1.0, 1.0, 1.2, 1.5, 2.0, 2.0, 2.5, 3.0, 3.0, 3.5, 4.0, 4.0, 4.5, 5.0, 5.0, 6.0, 6.0, 7.0, 7.0, 8.0, 8.0, 9.0, 10.0, 10.0],
      "normalized_values": [1.02, 0.98, 1.01, 0.97, 1.00, 0.95, 0.93, 0.90, 0.92, 0.88, 0.85, 0.87, 0.82, 0.78, 0.80, 0.76, 0.72, 0.75, 0.68, 0.70, 0.62, 0.65, 0.58, 0.60, 0.55, 0.50, 0.52],
      "digitization_method": "webplotdigitizer"
    },
    "tensile_strength": {
      "test_standard": "ASTM D3039 (UNT)",
      "test_config": {
        "loading_direction_deg": 0,
        "temperature_C": 23,
        "humidity": "ambient",
        "n_specimens_per_point": 30
      },
      "void_content_pct": [0.5, 0.7, 0.8, 1.0, 1.0, 1.2, 1.5, 2.0, 2.0, 2.5, 3.0, 3.0, 3.5, 4.0, 4.0, 4.5, 5.0, 5.0, 6.0, 6.0, 7.0, 7.0, 8.0, 8.0, 9.0, 10.0, 10.0],
      "normalized_values": [1.01, 1.00, 0.99, 0.98, 1.00, 0.97, 0.96, 0.94, 0.95, 0.92, 0.90, 0.91, 0.88, 0.86, 0.87, 0.84, 0.82, 0.83, 0.78, 0.80, 0.75, 0.77, 0.72, 0.73, 0.70, 0.67, 0.68],
      "digitization_method": "webplotdigitizer"
    }
  },
  "notes": "Data from Fig. 5a. Normalized strength = specimen / baseline group mean. Baseline = <2% porosity group."
}
